{
  "base_url": "https://integrate.api.nvidia.com/v1",
  "created_at": "2026-05-15T21:59:34.493581+00:00",
  "ok": true,
  "provider": "nvidia",
  "repeat": 1,
  "results": [
    {
      "content_preview": "OK",
      "finish_reason": "stop",
      "model": "mistralai/mistral-large-3-675b-instruct-2512",
      "prompt": "smoke",
      "status": "returned",
      "timeout_seconds": 180,
      "total_seconds": 4.094
    }
  ],
  "schema_version": "model-benchmark-v1",
  "suite": "smoke",
  "summaries": [
    {
      "attempt_count": 1,
      "avg_total_seconds": 4.094,
      "chat_ready": true,
      "max_total_seconds": 4.094,
      "model": "mistralai/mistral-large-3-675b-instruct-2512",
      "recommended_timeout_seconds": 60,
      "success_count": 1,
      "success_rate": 1.0
    }
  ]
}