{
  "base_url": "https://integrate.api.nvidia.com/v1",
  "created_at": "2026-05-15T21:59:28.479000+00:00",
  "ok": true,
  "provider": "nvidia",
  "repeat": 1,
  "results": [
    {
      "error": "TimeoutError: The read operation timed out",
      "model": "deepseek-ai/deepseek-v4-pro",
      "prompt": "smoke",
      "status": "timeout_or_error",
      "timeout_seconds": 180,
      "total_seconds": 180.286
    }
  ],
  "schema_version": "model-benchmark-v1",
  "suite": "smoke",
  "summaries": [
    {
      "attempt_count": 1,
      "avg_total_seconds": null,
      "chat_ready": false,
      "max_total_seconds": null,
      "model": "deepseek-ai/deepseek-v4-pro",
      "recommended_timeout_seconds": 180,
      "success_count": 0,
      "success_rate": 0.0
    }
  ]
}