{
  "base_url": "https://integrate.api.nvidia.com/v1",
  "created_at": "2026-05-15T21:56:26.608638+00:00",
  "ok": true,
  "provider": "nvidia",
  "repeat": 1,
  "results": [
    {
      "content_preview": "OK",
      "finish_reason": "stop",
      "model": "z-ai/glm-5.1",
      "prompt": "smoke",
      "status": "returned",
      "timeout_seconds": 180,
      "total_seconds": 106.568
    }
  ],
  "schema_version": "model-benchmark-v1",
  "suite": "smoke",
  "summaries": [
    {
      "attempt_count": 1,
      "avg_total_seconds": 106.568,
      "chat_ready": true,
      "max_total_seconds": 106.568,
      "model": "z-ai/glm-5.1",
      "recommended_timeout_seconds": 214,
      "success_count": 1,
      "success_rate": 1.0
    }
  ]
}