{
  "base_url": "https://integrate.api.nvidia.com/v1",
  "created_at": "2026-05-15T22:50:29.591469+00:00",
  "ok": true,
  "provider": "nvidia",
  "repeat": 1,
  "results": [
    {
      "content_preview": "OK",
      "finish_reason": "stop",
      "model": "meta/llama-4-maverick-17b-128e-instruct",
      "prompt": "smoke",
      "status": "returned",
      "timeout_seconds": 240,
      "total_seconds": 0.767
    },
    {
      "content_preview": "OK",
      "finish_reason": "stop",
      "model": "mistralai/mistral-large-3-675b-instruct-2512",
      "prompt": "smoke",
      "status": "returned",
      "timeout_seconds": 240,
      "total_seconds": 21.996
    },
    {
      "error": "TimeoutError: The read operation timed out",
      "model": "z-ai/glm-5.1",
      "prompt": "smoke",
      "status": "timeout_or_error",
      "timeout_seconds": 240,
      "total_seconds": 240.191
    },
    {
      "content_preview": "OK",
      "finish_reason": "stop",
      "model": "deepseek-ai/deepseek-v4-flash",
      "prompt": "smoke",
      "status": "returned",
      "timeout_seconds": 240,
      "total_seconds": 213.927
    },
    {
      "content_preview": "\n\nOK",
      "finish_reason": "stop",
      "model": "minimaxai/minimax-m2.7",
      "prompt": "smoke",
      "status": "returned",
      "timeout_seconds": 240,
      "total_seconds": 50.85
    },
    {
      "content_preview": "OK",
      "finish_reason": "stop",
      "model": "moonshotai/kimi-k2.6",
      "prompt": "smoke",
      "status": "returned",
      "timeout_seconds": 240,
      "total_seconds": 19.457
    }
  ],
  "schema_version": "model-benchmark-v1",
  "suite": "smoke",
  "summaries": [
    {
      "attempt_count": 1,
      "avg_total_seconds": 0.767,
      "chat_ready": true,
      "max_total_seconds": 0.767,
      "model": "meta/llama-4-maverick-17b-128e-instruct",
      "recommended_timeout_seconds": 60,
      "success_count": 1,
      "success_rate": 1.0
    },
    {
      "attempt_count": 1,
      "avg_total_seconds": 21.996,
      "chat_ready": true,
      "max_total_seconds": 21.996,
      "model": "mistralai/mistral-large-3-675b-instruct-2512",
      "recommended_timeout_seconds": 60,
      "success_count": 1,
      "success_rate": 1.0
    },
    {
      "attempt_count": 1,
      "avg_total_seconds": null,
      "chat_ready": false,
      "max_total_seconds": null,
      "model": "z-ai/glm-5.1",
      "recommended_timeout_seconds": 240,
      "success_count": 0,
      "success_rate": 0.0
    },
    {
      "attempt_count": 1,
      "avg_total_seconds": 213.927,
      "chat_ready": false,
      "max_total_seconds": 213.927,
      "model": "deepseek-ai/deepseek-v4-flash",
      "recommended_timeout_seconds": 428,
      "success_count": 1,
      "success_rate": 1.0
    },
    {
      "attempt_count": 1,
      "avg_total_seconds": 50.85,
      "chat_ready": true,
      "max_total_seconds": 50.85,
      "model": "minimaxai/minimax-m2.7",
      "recommended_timeout_seconds": 102,
      "success_count": 1,
      "success_rate": 1.0
    },
    {
      "attempt_count": 1,
      "avg_total_seconds": 19.457,
      "chat_ready": true,
      "max_total_seconds": 19.457,
      "model": "moonshotai/kimi-k2.6",
      "recommended_timeout_seconds": 60,
      "success_count": 1,
      "success_rate": 1.0
    }
  ]
}